nama,ulasan,label,sentiment,score
muhri mohtar,"Tempat yang bagus. Luar biasa bahkan. Sayang tidak dikelola dengan baik. Jalan buruk, banyak pungli, jalur tidak aman hanya sebagian masalah. Selain itu pengelolaan parkir semrawut. Ditambah tidak adanya rambu penunjuk jalan yang baik. Masalah utama spot ini adalah pengelolaan dan keamanan.",NEGATIVE,"[{'label': 'NEGATIVE', 'score': 0.9970646500587463}]",0.9970646500587463
ROSE THE ANT TO,"Lokasinya bagus, tapi sayang terlalu banyak pungutan.",NEGATIVE,"[{'label': 'NEGATIVE', 'score': 0.9942042231559753}]",0.9942042231559753
Muhammad Iqbal,Tempatnya adalah tambang kapur yg masi aktif. Sangat berbahaya dan minim pengamanan. Terutama banyak warga lokal yg suka meminta pungutan liar di jalan dengan dalih biaya masuk. …,NEGATIVE,"[{'label': 'NEGATIVE', 'score': 0.9982969164848328}]",0.9982969164848328
citra nilam,"Tempat yang cocok untuk berlibur bagi warga di Jawa Timur, khususnya Surabaya dan sekitarnya yang ingin menjelajah apiknya Pulau Madura. Tidak jauh dari Jembatan Suramadu. …",POSITIVE,"[{'label': 'POSITIVE', 'score': 0.9989001750946045}]",0.9989001750946045
Dedi Nurohman,Pemandangan sangat bagus tapi sistem parkir kurang teratur.,NEGATIVE,"[{'label': 'NEGATIVE', 'score': 0.9967222809791565}]",0.9967222809791565
wisnu asmara,Kurang terawat,NEGATIVE,"[{'label': 'NEGATIVE', 'score': 0.9997003078460693}]",0.9997003078460693
Abdul Komar,"parkir mahal, tiket masuk anak batita di itung juga, akses jalan sempit sering papasan sama dam truk",NEGATIVE,"[{'label': 'NEGATIVE', 'score': 0.9915355443954468}]",0.9915355443954468
Febri Indra Arianto,"Bukit Jaddiih ini merupakan salah satu tempat wisata yang digemari bukan hanya orang madura saja, namun juga orang-orang dari luar pulau jawa. Disana terdapat pemandangan yang indah yang cocok untuk mengabadikan momen bersama keluarga dan …",POSITIVE,"[{'label': 'POSITIVE', 'score': 0.999783456325531}]",0.999783456325531
ongko wijoyo,"Tempatnya indah, sayang jalannya masih harus diperbaiki",NEGATIVE,"[{'label': 'NEGATIVE', 'score': 0.9461807608604431}]",0.9461807608604431
Ramadhani Fitria,Bukit kapur yg bagus banget. Apalagi kalo dikelola secara baik. Terletak di kabupaten Bangkalan. Dari jalan raya masuknya sekitar 4 km. Hanya bisa di akses dengan kendaraan pribadi. Pemandangannya bagus karena tempatnya yang tinggi. Ada kolam renang dan tempat bermain. Sebelum masuk ke area banyak terdapat gua-gua alami yang besar.,POSITIVE,"[{'label': 'POSITIVE', 'score': 0.9994986057281494}]",0.9994986057281494
iin Ratnasari,"Kalo pertama kali kesini jika menggunakan maps harus benar"" Teliti,,, karena kurang akurat. Tempatnya masuk ke perkampungan gitu, akses jalan dari pintu masuk madura ke lokasi masih bagus, hanya waktu masuk ke buktinya saja yang rusak karena tanah kapur...",NEGATIVE,"[{'label': 'NEGATIVE', 'score': 0.9925575256347656}]",0.9925575256347656
Muhammad Toha,"Lumayan Bagus, cuman pada saat kemarau berdebu...",NEGATIVE,"[{'label': 'NEGATIVE', 'score': 0.9817719459533691}]",0.9817719459533691
Papa Rasya,Mantap keren sekali view nya dan banyak spot foto Instagramable... Cuman masuk nya bayar lagi kalo yang ada kolam SM goa pote. Di depan pintu masuk bayar 16 ribu kalo ke kolam yg ada d gambar bayar lagi 10 ribu SM parkir 2000. Tapi kalo langsung ke atas bukit gak bayar lagi bisa naik muter lewat jalan yang d laluin truk truk...,POSITIVE,"[{'label': 'POSITIVE', 'score': 0.9783518314361572}]",0.9783518314361572
yolanda gunawan,"bagus buat foto2. kesana waktu weekend, wah rame banget, parkirnya aja juga susah. tapi okelah terbayar sm pemandangannya",POSITIVE,"[{'label': 'POSITIVE', 'score': 0.9985126852989197}]",0.9985126852989197
Haekal Haydn,"Bagus sih..  Tapii...  Untuk masuk ada 2 kali penarikan, 10k untuk parkir lalu ditagih lagi untuk keamaan 10k, lalu untuk masuk ke goa ronte (yang ada danau) juga ditarik lagi tapi saya ga tahu berapa karena sudah tidak mood untuk masuk (setelah bayar 2 kali)",NEGATIVE,"[{'label': 'NEGATIVE', 'score': 0.9981398582458496}]",0.9981398582458496
hadhytana tono,"Bukit Jaddhih di Tahun 2020 memprihatinkan, kondisi lingkungan wisatanya masih belum terkondisikan dengan baik, beberapa batu gamping retak-retak sehingga menghawatirkan  wisatawan yang berkunjung, harapan kami semoga ada perhatian.",NEGATIVE,"[{'label': 'NEGATIVE', 'score': 0.9985753297805786}]",0.9985753297805786
Laila Turokhmah,Lumayan...gk sesuai expetasi..aire kotor.,POSITIVE,"[{'label': 'POSITIVE', 'score': 0.9469843506813049}]",0.9469843506813049
Salim haris,klo skala 1 smp 10 . ya nilai 7 .lumayan cuma perlu perbaikan khususnya jalan menuju ke sana maupun jalan di tempat wisatanya . tidak ada toilet juga merupakan kekurangannya... smg dikedepannya bagus,POSITIVE,"[{'label': 'POSITIVE', 'score': 0.7786901593208313}]",0.7786901593208313
syiroy uddin,Tempat yang bagus untuk sebuah destinasi wisata baru yang sedang berkembang walaupun akses untuk tempatnya sangat sangat perlu untuk diperbaiki. Dan semoga terus untuk selalu ditambah untuk tempat - tempat fotonya dan fasilitas-fasilitas …,POSITIVE,"[{'label': 'POSITIVE', 'score': 0.9989376664161682}]",0.9989376664161682
IGRA Larangan,"Datang dan kunjungi laah bukit jaddih di bangkalan madura.

Menawarkan pemandangan alam yg indah dan romantis, cocok biat wisatawan lokal …",POSITIVE,"[{'label': 'POSITIVE', 'score': 0.9997537732124329}]",0.9997537732124329
DIRGA PRAYA,"Sebetulnya ini tempat pertambangan AKTIF. jadi cukup berbahaya bisa runtuh sewaktu"". Belum ada fasilitas dasar untuk tempat wisata seperti toilet, dll. …",NEGATIVE,"[{'label': 'NEGATIVE', 'score': 0.999254047870636}]",0.999254047870636
Koco Jatmiko,Bekas tambang batu kapur yg dijadikan obyek wisata eksotik,POSITIVE,"[{'label': 'POSITIVE', 'score': 0.9626765251159668}]",0.9626765251159668
Reza Pahlevi,Bukit jaddih. Kenapa saya beri bintang 3. Ya tempat ini pada saat saya pertama kali berkunjung masih indah untuk kolam kecilnya. Airnya berwarna hijau kebiruan. Namun sekarang saat saya datang untuk ke 2 kalinya sudah banyak …,POSITIVE,"[{'label': 'POSITIVE', 'score': 0.553219199180603}]",0.553219199180603
Ivan Robin1,Bagus  untuk  off road dan berselfie ria,POSITIVE,"[{'label': 'POSITIVE', 'score': 0.9991816878318787}]",0.9991816878318787
Putut Sugiharto,"Pemandangan exotik
Asri n indah.cuman harus dikelola oleh satu instansi atau swasta yang berpengalaman. Supaya tidak semrawut. Terutama mengenai jalur masuk nya, retribusi nya.",POSITIVE,"[{'label': 'POSITIVE', 'score': 0.9740117192268372}]",0.9740117192268372
bendox garez,Masih dalam tahap pengerjaan. Panas .,POSITIVE,"[{'label': 'POSITIVE', 'score': 0.9417117238044739}]",0.9417117238044739
Wahyu Erland,Tenpat rekreasi yg sungguh serasa berada di negeri antah berantah ... sp amazing bukit kapurnya... juga tempat ug baik utk foto2 jg berenang.. dr jembatan suramadu (yg sekarang gratis) relative dekat banget dengan surabaya. So tunggu apa lagi mas bro ...,POSITIVE,"[{'label': 'POSITIVE', 'score': 0.9927615523338318}]",0.9927615523338318
Muhammad Dhika,"Tempat yang cukup panas kalau berkunjung di siang hari, tetapi banyak juga tersedia kedai jajanan dan minuman. Banyak spot foto yang anti mainstream dan pemandangan yang sangat menarik apabila di sore hari
Sangat menarik bagi orang yang suka foto landscape",POSITIVE,"[{'label': 'POSITIVE', 'score': 0.9960195422172546}]",0.9960195422172546
Sepatrex House,"Bukit jaddih merupakan tempat penambangan batu bata putih. Dulu disini juga menjadi tempat penyimpanan senjata. Bukit ini berada di desa Jaddih, sehingga penamaannyapun diberi nama bukit jaddih. Sekarang tempat ini menjadi salahsayu …",NEGATIVE,"[{'label': 'NEGATIVE', 'score': 0.9993981122970581}]",0.9993981122970581
jenny julianti,Tempatnya bgs tp sayang byk pungli yg tdk jls,NEGATIVE,"[{'label': 'NEGATIVE', 'score': 0.9614502191543579}]",0.9614502191543579
rusdi zulkarnain,Bukit Jadih adalah lokasi penambangan batu kapur di Desa Jadih Kecamatan Socah Kabupaten Bangkalan Pulau Madura. …,NEGATIVE,"[{'label': 'NEGATIVE', 'score': 0.7492403984069824}]",0.7492403984069824
wahyu prasetya,"masyallah allahu akbar bagus sekali sedikit panas tidak apa ada tempat penyewaan payung kok, jangan lupa ya pakai baju yg tipis aja karena cuaca d situ lumayan panas",POSITIVE,"[{'label': 'POSITIVE', 'score': 0.9990968704223633}]",0.9990968704223633
Paskalis Bangkit,"Gile belum turun dari mobil aja udah ditarikin duit. Pas ditanya ada tiketnya ga ada,udh gt 3 lapis pula punglinya untuk masuk. Total 4x ditembakin pungli. Not rekomended lah",NEGATIVE,"[{'label': 'NEGATIVE', 'score': 0.9985136389732361}]",0.9985136389732361
Ihnal ef Muhtar,"Kalau mau ke lokasi harus siap menghadapi kepul serpihan dari batu kapurnya. Tidak dianjurkan pakai mobil sedan. Harga tiket 23 September 2018:  1 mobil 20000 rupiah, perorang 5000 rupiah.",NEGATIVE,"[{'label': 'NEGATIVE', 'score': 0.9987176656723022}]",0.9987176656723022
Nency Pelisay,"Pas sampai destinasi yg dituju danau birunya lagi kering jd cuma foto2 di antara batuan kapur deh.. Byk pungli, blm di kelola dgn baik.Sepanjang masuk madura kanan kiri byk bgt makam.hihii plus kurang cocok sm cuaca panasnya madura😯 …",NEGATIVE,"[{'label': 'NEGATIVE', 'score': 0.9995812773704529}]",0.9995812773704529
Riha Rahma Mufida,Salah satu tempat wisata bukit kapur yang penggaliannya masih aktif di kabupaten Bangkalan khususnya di daerah Jaddih. Tempat wisata ini masih terus berbenah dalam pembangunannya. Terdapat kolam renang untuk anak-anak dan area danau dengan beberapa perahu kayu untuk sekedar mengelilinginya.,POSITIVE,"[{'label': 'POSITIVE', 'score': 0.995405912399292}]",0.995405912399292
Anne Afiat,Bagus buat foto2 tapi panasnya minta ampyuuun..,NEGATIVE,"[{'label': 'NEGATIVE', 'score': 0.9974368214607239}]",0.9974368214607239
Yoga Pramono,"Pemandangan nya bagus sekali.  Namun waspada akan ada permintaan untuk bayar tiket ""sukarela"". Berikan secukupnya saja.  Karena untuk kedua kalinya akan ada tiket resmi. Tidak mahal dan sangat layak untuk pemandangan yang akan didapatkan.",POSITIVE,"[{'label': 'POSITIVE', 'score': 0.9979270696640015}]",0.9979270696640015
Yessy Putri Anissah,"Pemandangannya bagus sampe bengong kok bisa galian tambang kapur seindah ini.
Di sini itu panas banget tapi kadang adem juga, mungkin karena waktu itu kesini cuaca agak mendung. …",POSITIVE,"[{'label': 'POSITIVE', 'score': 0.9998225569725037}]",0.9998225569725037
Yuvico Setiawan,Bagus banget kalo dibuat prewed nih 😍 …,POSITIVE,"[{'label': 'POSITIVE', 'score': 0.9997833371162415}]",0.9997833371162415
Dimas Setiaji,"Nice place, ga terlalu jauh dari jembatan suramadu",POSITIVE,"[{'label': 'POSITIVE', 'score': 0.999309778213501}]",0.999309778213501
Ari Wibowo,"pertama kesini kesan pertama : Keren!!
bagi yang suka berfoto ria / swafoto, karena memang instagrammable …",NEGATIVE,"[{'label': 'NEGATIVE', 'score': 0.7543992400169373}]",0.7543992400169373
S A M S U D I,Dua kali kesana pertama dengan keluarga yg kedua sama teman di kantor,POSITIVE,"[{'label': 'POSITIVE', 'score': 0.9515462517738342}]",0.9515462517738342
yunaansori,"Tempatnya bagus, cocok buat liburan keluarga. Hanya saja disarankan memakai pakaian yang tidak terlalu tebal karena cuaca disana sangat panas. Harga tiket masuk terjangkau dan dikenakan perkepala.",POSITIVE,"[{'label': 'POSITIVE', 'score': 0.9981259703636169}]",0.9981259703636169
Ardhy Brahmana,"Tgl 29/11/2020 saya kesini, cuma lokasi galian kapur. Masuk pertama bayar seikhlas nya, dikasih 5 ribu cemberut mukanya. Masuk kedua bayar 20 ribu. Di dalam parkir mobil 10 ribu. Gk ada yg jual makanan, kl haus laper kudu siap bawa dr rumah. Gk ada musholah sama toilet pun gk ada.",NEGATIVE,"[{'label': 'NEGATIVE', 'score': 0.992968738079071}]",0.992968738079071
anggun pribadi,Banyak tarikannya beda beda jd males..,NEGATIVE,"[{'label': 'NEGATIVE', 'score': 0.9991499185562134}]",0.9991499185562134
Herman Susanto,Sya n kluarga liburan kesini..  Indah juga.   Suatu saat saya akan ksini lagi..  Insyallah.. Madura. Is the best,POSITIVE,"[{'label': 'POSITIVE', 'score': 0.9998482465744019}]",0.9998482465744019
aryanto hunowu,"Bukit jeddih adalah salah satu destinasi wisata yang asalnya adalah ex  tambang gunung kapur.
Ada spot yg bisa di manfaatkan untuk foto pra wedding.
Juga di lokasi tersebut dibangun kolam renang untuk segala umur...",POSITIVE,"[{'label': 'POSITIVE', 'score': 0.8473415970802307}]",0.8473415970802307
hamid hasim,"Berpetualang di alam raya bukanlah perjalanan biasa bagi manusia, bila dianoligikan ke dalam perjalanan hidup seseorang, sebuah petualangan akan memberikan pesan nyata, baik itu tentang perjuangan, pengorbanan atau tentang hakikat manusia …",POSITIVE,"[{'label': 'POSITIVE', 'score': 0.927280843257904}]",0.927280843257904
HARMIAH Amir,"Wisata yg menyenangkan, batu kapur yg di sulap oleh tangan2 trampil👍👍👍 …",POSITIVE,"[{'label': 'POSITIVE', 'score': 0.9993783235549927}]",0.9993783235549927
KP-RACHMAD AGUNG PRASTYAWAN,Bukit jaddih ini tidak layak menjadi destinasi wisata jika aksi pungli dari premanisme disekitar masih merajalela dan SANGAT PARAH. bagi yg mau ke wisata jaddih ini mending pikir ulang kalo mau kesana daripada setor uang yg gak ada gunanya.,NEGATIVE,"[{'label': 'NEGATIVE', 'score': 0.9992881417274475}]",0.9992881417274475
Eko Marsudi Santosa,Tempatnya bagus bgt,POSITIVE,"[{'label': 'POSITIVE', 'score': 0.9998606443405151}]",0.9998606443405151
Endroharto yoedono,"Saya beri bintang 2 karena sepertinya tempat wisata pemandangan alam gunung Kapur ini tidak lagi ada pengelolaan dari pemerintah daerah setempat, berkesan tak terjaga, terawat dan liar,serta danau yg dl indah utk wisata air, sekarang kering …",NEGATIVE,"[{'label': 'NEGATIVE', 'score': 0.9962441921234131}]",0.9962441921234131
Y AFI,Sebaiknya tidak berkunjung pada saat menjelang malam.,NEGATIVE,"[{'label': 'NEGATIVE', 'score': 0.6803588271141052}]",0.6803588271141052
Debora Himawan,"Batuan alamnya sangat indah, walaupun cuaca disini panas terik dan kering",POSITIVE,"[{'label': 'POSITIVE', 'score': 0.9998425245285034}]",0.9998425245285034
Muh. Isa Asy'ari,Tempat yang cocok buat touring,POSITIVE,"[{'label': 'POSITIVE', 'score': 0.9998458623886108}]",0.9998458623886108
sophie aunul,"Buat kamu yang suka eksis di medsos tempat ini bisa dijadikan background foto yang keren. Karena ini bukit kapur, sebaiknya kamu pakai sunblock spf tinggi, pakai masker, bawa payung at least pakai topi. anyway.. siap-siap receh karena ada beberapa titik dimana kamu harus bayar 'retribusi' lokal.",NEGATIVE,"[{'label': 'NEGATIVE', 'score': 0.8262186646461487}]",0.8262186646461487
Ken,"Hati - hati kalo kesana, banyak begal nya. Kalo bisa kesana rame - rame dan banyak cowoknya. …",NEGATIVE,"[{'label': 'NEGATIVE', 'score': 0.9567755460739136}]",0.9567755460739136
Fahri H,Wisata yg cukup bagus dari bukit kapur,POSITIVE,"[{'label': 'POSITIVE', 'score': 0.9995697140693665}]",0.9995697140693665
Yokhanan PRASETYONO,"Bekas pertambangan kapur yang eksotis. Cocok buat yang punya hobby fotografi. Disarankan untuk datang pada pagi hari atau sore hari, siang panasnya minta ampun 😁 …",NEGATIVE,"[{'label': 'NEGATIVE', 'score': 0.9678531885147095}]",0.9678531885147095
Dsamuel,"Bagus tempatnya tp terlalu banyak ditagih tiket masuk, meski cm 1 org 5rb tp kl tiap kali diminta sama aja
Dan wahana nya cm bisa yg goa pote dan skrng airnya kering ga kyk dlu warna biru …",NEGATIVE,"[{'label': 'NEGATIVE', 'score': 0.9821560978889465}]",0.9821560978889465
Randy Wahyu,"Bukit Jaddih adalah tempat eksploitasi semacam batuan kapur yang menjadi tempat wisata. Akses tidak terlalu jauh dari Jembatan Suramadu, tempatnya bagus, tiket masuknya murah, dan juga dapat menemukan oleh - oleh khas dari Pulau Madura …",NEGATIVE,"[{'label': 'NEGATIVE', 'score': 0.9528891444206238}]",0.9528891444206238
solikin adel,"Terbengkalai dan di kelola warga sekitar
1.byr 10 RB iuran warga
2. Byr masuk area 20 …",NEGATIVE,"[{'label': 'NEGATIVE', 'score': 0.9897897839546204}]",0.9897897839546204
Andri Siregar,"Tebing tebing batu kapur yang sangat keren. Sepertinya lokasi ini bekas pengambilan batu kapur untuk digunakan sebagai batu bata. Kalau kesini sebaiknya bawa masker dan kacamata, sebab cuacanya panas dan bayak debu. Dan hati-hati kalau naik keatas tebingnya karena tidak ada pagar pembatas.",NEGATIVE,"[{'label': 'NEGATIVE', 'score': 0.9382309913635254}]",0.9382309913635254
Miftah Kafabi,"Wisatanya keren, spotnya bagus 😍 tapi penjaganya kurang... Tour guidenya gak ada.. Aksesnya masih blm lancar karena terhalang jalan dan gantian sama truk pengangkut kapurnya ... Tapi salut sama viewnya …",NEGATIVE,"[{'label': 'NEGATIVE', 'score': 0.9980493783950806}]",0.9980493783950806
Indra Dewa Putra,"saran saya jangan bawa motor sendiri kesini, kalo ada mobil mending bawa mobil. aksesnya rawan begal. udah banyak kejadian. tapi spot nya emang bagus dan cocok buat foto foto. bawa payung sama jaket, panassss coy, bisa belang lama lama disana",POSITIVE,"[{'label': 'POSITIVE', 'score': 0.9993277788162231}]",0.9993277788162231
Tommy W,Bukit Jaddih ini merupakan bentukan akibat penambangan kapur putih selama bertahun-tahun hingga membentuk keelokan tebing raksasa dengan bentuk eksotis dan artistik. …,POSITIVE,"[{'label': 'POSITIVE', 'score': 0.9983900785446167}]",0.9983900785446167
bb_na Lyrics,"Menarik dan unik, tapi klo pas siang-siang cuacanya panas",POSITIVE,"[{'label': 'POSITIVE', 'score': 0.9964247345924377}]",0.9964247345924377
Cak BUR,"sangat tidak recomended, punglinya terlalu banyak, tempat banyak sampah tidak terawat
mohon maaf harus jujur, kasian yg jauh2 datang malah kecewa",NEGATIVE,"[{'label': 'NEGATIVE', 'score': 0.9986635446548462}]",0.9986635446548462
Edy Suhartono,"Bukit kapur yg menjadi lokasi tambang di salah satu sudut kota Bangkalan ini telah menjadi salah satu obyek wisata dadakan. Dulu banyak spot spot bagus yg bisa dijadikan back ground foto,saat ini spot spot foto tersebut akhirnya banyak yg hilang akibat efek pertambangan batu kapur.",NEGATIVE,"[{'label': 'NEGATIVE', 'score': 0.9934886693954468}]",0.9934886693954468
yulita anggrainy,"Tempatnya asyik buat yg suka foto"" ato selfie. Pemandangan bagus. Harga tiket masuknya tidak memberatkan alias murah.  Hehehe.. Cm agak panas, jd jgn lupa bawa payung ato topi ya.😍😍😍 …",POSITIVE,"[{'label': 'POSITIVE', 'score': 0.998931348323822}]",0.998931348323822
Moh Rizal,Setiap pintu masuk  hrus  bayar  kan  tak  logic  mau  lihat  kapur  putih  aja  harus  anggaran 100rb,NEGATIVE,"[{'label': 'NEGATIVE', 'score': 0.9967466592788696}]",0.9967466592788696
Gatut Wijaya,"Bukit Kapur yang sedang dalam proses penambangan.
Bukan tempat wisata, walau view lumayan. Akses jalan buruk, petunjuk arah tidak lengkap, debu sepanjang jalan membahayakan kesehatan. Belum layak dikunjungi.
Mungkin dilain waktu cocok sebagai destinasi wisata yang menawan.",POSITIVE,"[{'label': 'POSITIVE', 'score': 0.8848975896835327}]",0.8848975896835327
paul liant,"Tempat wisata baru di pulau madura. Menawarkan tebing gunung batu bekas penambangan. Lokasinya 1 jam dari Suramadu. Bisa mampir jika ingin menuju Kota Bangkalan. Tp hati2 jalan cukup sempit dan sepi, apalagi sore atau malam. Siapkan uang receh krn banyak pungli",NEGATIVE,"[{'label': 'NEGATIVE', 'score': 0.9716360569000244}]",0.9716360569000244
Wahyu Putro,"Tempatnya indah dan menarik. Kita bisa menuju puncak dengan mobil atau motor. Banyak spot spot yang baik untuk fotografer.
Cuma bagi pengendara motor harus hati hati. Karena disana rawan perampokan motor. Jika menuju kesana lebih baik menggunakan mobil.",POSITIVE,"[{'label': 'POSITIVE', 'score': 0.9981163740158081}]",0.9981163740158081
Ruzdy syarief,Di sarankan untuk datang di pagi atau sore hari. Kalau pass siang hari panasnya kebangetan,POSITIVE,"[{'label': 'POSITIVE', 'score': 0.9117534756660461}]",0.9117534756660461
Debie Wijaya,"Daerah perbukitan kapur dengan aktivitas penggalian/pomotongan untuk membuat bahan bangunan/batu bata, gamping dan kapur dinding. Kontur bukit bekas aktivitas tsb indah, instagramable. Bila cuaca  panas maka agak berdebu, perlu masker dan sun glasses.",POSITIVE,"[{'label': 'POSITIVE', 'score': 0.9756799340248108}]",0.9756799340248108
Luluk Husnul Khotimah,Unt yg suka fto2 tempat ini wajib unt dikunjungi,POSITIVE,"[{'label': 'POSITIVE', 'score': 0.895149290561676}]",0.895149290561676
Muhammad Soedarsono,"Pemandangannya bagus, perpaduan antara bukit kapur putih abu-abu dan beberapa danau mini yang airnya berwarna hijau. Salah satunya yang paling luas digunakan sebagai pemandian umum.",POSITIVE,"[{'label': 'POSITIVE', 'score': 0.9956606030464172}]",0.9956606030464172
Supy Supy,Pemandangan lumayan bagus,POSITIVE,"[{'label': 'POSITIVE', 'score': 0.9997381567955017}]",0.9997381567955017
Novita Amalia,"Tidak seperti di instagram, air yang seharusnya beewarna hijau tosca jd berwarna hijau lumut, jalan menuju masuknya bergelombang, info dr sekitar hati2 yang membawa motor kalau sore bny begal",NEGATIVE,"[{'label': 'NEGATIVE', 'score': 0.9916415214538574}]",0.9916415214538574
marta sandhi aji,"+) di sini Anda akan menjumpai bekas tambang batu kapur yg dijadikan sebagai tempat wisata berupa goa, kolam, dll. bagus untuk sekedar nyari tempat wisata alam yg beda dr yg lain untuk mengisi hari libur Anda …",NEGATIVE,"[{'label': 'NEGATIVE', 'score': 0.9794986844062805}]",0.9794986844062805
okems selow,"Bekas tambang.. entah masih ada penambangan atau tidak tp msh terdapat 3 alat berat di sana.. siapin masker aja.. berdebu sangat.. klo musim panas yaa mnding paket topi n tangan panjang klo mao poto-poto.. airnya di sana juga rasanya kurang,, mending beli air botol kalo jajan di warung jangan beli es.. udah itu aja..",NEGATIVE,"[{'label': 'NEGATIVE', 'score': 0.9995183944702148}]",0.9995183944702148
Marcell Randy,"spot foto2nya banyak sih, tiket masuknya jg ga mahal2 banget, cuma panasnya itu yg ga nahan wkwk. recomen kesini waktu hari biasa aja, jangan waktu hari libur apalagi long weekend karna bakalan tambah panas wkwk",NEGATIVE,"[{'label': 'NEGATIVE', 'score': 0.9866190552711487}]",0.9866190552711487
EkoWawan Channel,wisata alam yang masih alami. pemandangan gunung kapur yang eksotik akan memanjakan mata anda. naik lagi ke puncak maka akan telihat hamparan bukit teletubbis. hijauuu... serasa menyentuh awan,POSITIVE,"[{'label': 'POSITIVE', 'score': 0.9982000589370728}]",0.9982000589370728
Ali Nugroho,Tempat buatan tangan manusia hasil sisa dari tambang batu putih yang suatu saat akan habis di keruk.,NEGATIVE,"[{'label': 'NEGATIVE', 'score': 0.9992524981498718}]",0.9992524981498718
Alifah Farhana,"Tempatnya bagus banget, rasanya gak kayak di madura. Ini bukitnya kapur jadi warna putih gitu, danaunya hijauu bagus ada sampannya juga sekedar buat naik dan foto aja soalnya danaunya kecil. Ada goa, pemandian airpanas juga ada. Enak dateng pas hari efektif pas ga holiday, jadi sepi dan bisa lebih menikmati pemandangannya",POSITIVE,"[{'label': 'POSITIVE', 'score': 0.9991889595985413}]",0.9991889595985413
Raihan Khairullah,"Kerennn, pemandangan nya indah, semoga kedepan nya pengelolaan wisatanya agar lebih baik lgi",POSITIVE,"[{'label': 'POSITIVE', 'score': 0.9993201494216919}]",0.9993201494216919
Caesar Zulfahmi,"ramai walaupun panas cuacanya tempat luas dan nyaman untuk rekreasi bersama keluarga, ada orang jualan juga dan ramai di akhir pekan kebanyakan yang datang dari luar jawa timur",POSITIVE,"[{'label': 'POSITIVE', 'score': 0.9845995306968689}]",0.9845995306968689
Agus Ridwan Zani,"Untuk tempat panorama dan akses cukup bagus, hanya sayang kurang terkelola dgn baik, alat fasilitas keamanan dan keselamatan utk pengunjung masih kurang. Semoga ke depan akan lebih baik, dikelola dgn profesional yg juga mengutamakan keselamatan pengunjung. Trimksh.",NEGATIVE,"[{'label': 'NEGATIVE', 'score': 0.9513187408447266}]",0.9513187408447266
rey dhaa,"Tempat wisata yang kekinian
Lokasi :
1. Tempatnya masuk ke perdesaan ( penduduk sekitar ramah dan menunjukkan arah …",POSITIVE,"[{'label': 'POSITIVE', 'score': 0.9903830885887146}]",0.9903830885887146
Darmono Darmono,Tempat buat selfi bagus,POSITIVE,"[{'label': 'POSITIVE', 'score': 0.9997796416282654}]",0.9997796416282654
P. Rahayu,"Tempatnya sebetulnya bagus, tapi sayang banyak pungutan, dri awal masuk karcis (dihitung perorang) kalau mau poto di spot yg bagus bayar lagi",NEGATIVE,"[{'label': 'NEGATIVE', 'score': 0.9806946516036987}]",0.9806946516036987
Blur Kamera PDN Official,"Tempatnya sepi, dan kurang penjual makanan
Cocok untuk syut video / foto prewedding",NEGATIVE,"[{'label': 'NEGATIVE', 'score': 0.999488115310669}]",0.999488115310669
Adjie Ramadhan,"track nya bahaya buat bis, jalan sempit, banyak pohon yang terlalu rendah. kalo crash sam bis mungkin harus salah satu mundur, td crash sama truck mepet, hampir nyerempet. …",NEGATIVE,"[{'label': 'NEGATIVE', 'score': 0.9950631260871887}]",0.9950631260871887
Sintya Megaloka,"Enak, nyaman, cuman hati2 aja klo ada yg narik htm lg setelah di lewat pos pembayaran pertama. Kemaren aku kena pungli, buat htm doang habis 50rb",NEGATIVE,"[{'label': 'NEGATIVE', 'score': 0.7844013571739197}]",0.7844013571739197
Dian Branding Lokal,Kalo pagi bagus bangeet kak,POSITIVE,"[{'label': 'POSITIVE', 'score': 0.999810516834259}]",0.999810516834259
Anwar Black,Nyaman,POSITIVE,"[{'label': 'POSITIVE', 'score': 0.9333917498588562}]",0.9333917498588562
Tali Murko,Keamanan di jalan menuju tempat masih rawan sebab sepi,NEGATIVE,"[{'label': 'NEGATIVE', 'score': 0.991848349571228}]",0.991848349571228
Sri Yayu Ninglasari,Very recommended place to be visited. Tempatnya sangat bagus untuk foto-foto hanya saja cuacanya sangat panas dan terik sehingga sangat disarankan untuk membawa kacamata hitam. Tempat parkirnya pun sangat luas. Terdapat penjual minuman juga untuk menghilangkan dahaga saat panas terik. Setiap spot di Jaddih Hill ini sangat indah.,POSITIVE,"[{'label': 'POSITIVE', 'score': 0.9990401864051819}]",0.9990401864051819
