nama,ulasan,label,sentiment,score
Dewy Antriani,"Pertama kali kesini, pakai google map. Kalau dari jembatan suramadu nanti arahnya perempatan terus ke kiri. Nanti jalannya agak kecil sih kalau naik mobil papasan agak mepet, jalannya juga belum terlalu baik masih berlubang. Parkir masuk …",NEGATIVE,"[{'label': 'NEGATIVE', 'score': 0.9991971850395203}]",0.9991971850395203
Sulaiman Rhosyid,Minggu kemarin ngantar anak-anak wisata... Wisata ini diadakan oleh TPQ Al Firdaus tempat anak pertama belajar Tahfidz... …,POSITIVE,"[{'label': 'POSITIVE', 'score': 0.8906897902488708}]",0.8906897902488708
Santo Ali,Takjud dengan segala yang diciptakan oleh-Nya. Bukit Jaddih merupakan destinasi wisata di Kabupaten Bangkalan Madura. Pemandangannya memang beda dari tempat wisata pada umumnya. …,POSITIVE,"[{'label': 'POSITIVE', 'score': 0.9992436170578003}]",0.9992436170578003
Kusuma Wati,"Bagus buat foto2.. sayangnya jalan menuju TKP masih kurang bagus. Juga fasum agar ditingkatnya shg pengunjung nyaman..
Semoga kedepan makin tertata..👍🏻👍🏻 …",NEGATIVE,"[{'label': 'NEGATIVE', 'score': 0.9933536052703857}]",0.9933536052703857
christiyanto satriyo wibowo,Menurut aku cukup bagus untuk jalan2 ke sini. Cuman kitq ga tahu mana penarik karcis mana yg bukan. Kita naik mobil dicgat orang bawa karcis suruh bayar,POSITIVE,"[{'label': 'POSITIVE', 'score': 0.9821886420249939}]",0.9821886420249939
Atria Handono,"Kesini ketika buat video klip, ketika puasa, kebetulan mendung dan sempat hujan sebentar. Waktu itu kita ada yg menyertai dan diantar ke spot-spot terbaik yang jarang dipakai orang untuk spot photo atau video. …",POSITIVE,"[{'label': 'POSITIVE', 'score': 0.9850382208824158}]",0.9850382208824158
Emma erliana,"Bagus epik tempat nya hanya saja jalanan agak berkerikil bukan aspal (gak mulus lah) itu saja kendalanya...semoga saja dari pemerintah setempat bisa memperbaiki jalanan di sekitar wisata bukit Jaddih ke depannya ,",NEGATIVE,"[{'label': 'NEGATIVE', 'score': 0.8261616826057434}]",0.8261616826057434
Mayaria Desi,"tempat wisata ramah dikantong, hanya saja akses nya kurang nyaman, semoga mendapat perhatian & prioritas dr pemda setempat untuk akses menuju ke tmp wisata dan kedepannya makin tertata..👍🏻👍🏻 …",NEGATIVE,"[{'label': 'NEGATIVE', 'score': 0.9745868444442749}]",0.9745868444442749
metom sh,"Goa pote, bangkalan
Msh di sebelahnya dg bukit jaddih juga.
Mungkin artinya goa putih, krn bekas galian gn kapur, jd pasti putih. Dan krn …",NEGATIVE,"[{'label': 'NEGATIVE', 'score': 0.9974229335784912}]",0.9974229335784912
Mr EdiP,"Banyak yang bilang banyak pungli, mungkin iya,
Masuk kita di minta parkir 20.000 untuk mobil,
Kemudian di jalan kita di cegat dan di arahkan masuk ke gua masuk bayar lagi …",NEGATIVE,"[{'label': 'NEGATIVE', 'score': 0.9964948296546936}]",0.9964948296546936
L4W SHARE,Sangat disayangkan potensi wisata madura yang seharusnya bisa menjadi ikon wisata bangkalan tetapi masih banyak pungli dan keamanan menuju lokasi membuat wisatawan berpikir 2x untuk berkunjung kesini. Saya sebagai warga Bangkalan juga cukup …,NEGATIVE,"[{'label': 'NEGATIVE', 'score': 0.9981045722961426}]",0.9981045722961426
Theeya Tea,"Pemandangannya cukup instgramable.. bagus buat foto foto, hanya jalan akses kurang mulus, biaya parkir 20 rb.. bayar biaya masuk 5000 per orang..
Tempatnya belum dikelola secara profesional masih dikelola penduduk setempat. Tempatny agak kurang terawat .tp kalo dikelola lebih baik lagi bisa jadi hidden gemsnya di madura",NEGATIVE,"[{'label': 'NEGATIVE', 'score': 0.9767287969589233}]",0.9767287969589233
RUSSELL. ID,"Pengalaman wisata alam yang sangat menyenangkan, kondisi masih lumayan sepi dikarenakan berkunjung di hari jumat.
Kurang penunjuk arah yg jelas. Semoga kedepannya pengelolaan semakin baik lagi",NEGATIVE,"[{'label': 'NEGATIVE', 'score': 0.9805917143821716}]",0.9805917143821716
vina krisna lestari,"Tempatnya menurut saya biasa aja utk viewnya tapi kalau bisa pakai jasa guide aja utk dapat foto-foto bagus viewnya malah jadi terlihat keren tempatnya 👍,, …",POSITIVE,"[{'label': 'POSITIVE', 'score': 0.9992652535438538}]",0.9992652535438538
Muhammad Alvaro,"Tiket masuk roda 4 Rp20.000
Tiket pertandingan orangnya 5rb
Sudah waktunya untuk direnovasi.. Penampilan diperbaharui..",NEGATIVE,"[{'label': 'NEGATIVE', 'score': 0.9831493496894836}]",0.9831493496894836
annisa lathief,"Wisata Bekas Tambang kapur yang menarik dan eksotis, hanya saja untuk anak2 butuh pengawasan optimal dan lebih berhati2,, tempat parkir luas",POSITIVE,"[{'label': 'POSITIVE', 'score': 0.9947040677070618}]",0.9947040677070618
Hasby Asshiddiqi,"Bukit jeddih ini bukit kapur yang penambangannya masih aktif. Namun ada sisi yang sudah tidak beroperasi dan dijadikan wisata. Untuk view yang ditawarkan menarik. Untuk fasilitas ada warung makan, toilet (kurang tau keadaannya). Akses …",NEGATIVE,"[{'label': 'NEGATIVE', 'score': 0.9873692393302917}]",0.9873692393302917
Deo Prasetyo,Pamandangannya bukit bekas hasil tambang kapur cakep banget (instagramable)..cm sayang aksesnya kesana harus melewati jalanan rusak (jadi akses kluar masuk truk tambang juga). Saya naik mobil dikenakan karcis 20ribu di akses masuk …,NEGATIVE,"[{'label': 'NEGATIVE', 'score': 0.9912721514701843}]",0.9912721514701843
Xaveria,"Sangat oke tempatnya igable banget! Cuman jalanan kesini rada jelek, dan mayan lah dari kluaran suramadu. Worth it tapii 👌🏼 …",NEGATIVE,"[{'label': 'NEGATIVE', 'score': 0.6630234122276306}]",0.6630234122276306
Sri Wahyuni,"Jalan masuk bisa dibilang parah bgt,
Karcis masuk bayar 2X, pertama 10k, kedua 5k per org,
Tp view nya indah menurut saya, masih terlihat alami, …",POSITIVE,"[{'label': 'POSITIVE', 'score': 0.9949392080307007}]",0.9949392080307007
fathcul jannah,"Mmh karena ini penambangan, jadi tiap tahun seakan berubah ubah.
Kalau buat poto cocok pas panas terik. Tapi kalau untuk santai, cocoknya pas teduh pagi atau sorean. …",POSITIVE,"[{'label': 'POSITIVE', 'score': 0.7292665839195251}]",0.7292665839195251
AR channel,"Wisata lokal yg indah, pemanfaatan tambang batu kapur menjadi wisata.. Ada goa buatan.. Bisa lihat sunset di puncak tebing",POSITIVE,"[{'label': 'POSITIVE', 'score': 0.998252809047699}]",0.998252809047699
TITO AKDUA MUSIC OFFICIAL (KENDANG CILIK SKIL MASTER),"15menitan setelah keluar dari suramadu. Akses jln masih sempit lewat perkampungan.
Pemandangan sangat bagus bwt yg hobby foto"" sayang blm dikelola dgn baik,, akses …",NEGATIVE,"[{'label': 'NEGATIVE', 'score': 0.995762050151825}]",0.995762050151825
Yodika Yobellinda,"Jalan menuju bukit nya parah sihh, foto prewedding cocok. Masuk tiket 5.000 /org",NEGATIVE,"[{'label': 'NEGATIVE', 'score': 0.9982115030288696}]",0.9982115030288696
Ismi Yui,Bagus apalagi kalau cuaca mendukung dan datang di waktu yang tepat sekitar jam 8 atau 9 karena matahari sudah berada diatas tapi suhu tidak panas terik dan lebih menaikkan pesona alamnya,POSITIVE,"[{'label': 'POSITIVE', 'score': 0.9996641874313354}]",0.9996641874313354
Yulia Fithri,"Kesini sudah 3 kali dengan rombongan teman dan keluarga. Tempatnya luas banget, cuma agak panas ya",POSITIVE,"[{'label': 'POSITIVE', 'score': 0.9991656541824341}]",0.9991656541824341
Andi Surya Putra,"Kunjungan yang kesekian kalinya bersama keluarga besar, tempat tambang dan suasana bukit kapur putih tertata bekas tambang.
Goa poteh yg artistik dari hasil potongan penambang. Menghasilkan lubang goa yg menarik.",POSITIVE,"[{'label': 'POSITIVE', 'score': 0.9901464581489563}]",0.9901464581489563
Berkah Abadi Satoto,"Bekas tambang kapur di banhkalan madura. Sangat aesthetic utk lokasi foto dan video. Tiket masuk murah hanya 5rb per orang.
Ada tour guide, anak muda sekitar .. mereka jg jago take foto dan video. …",POSITIVE,"[{'label': 'POSITIVE', 'score': 0.994965136051178}]",0.994965136051178
Ichsan Nur Rizky,Pemandangannya bagus tetapi untuk kebersihan masih banyak sampah dimana-mana mungkin harus ditambah fasilitas tempat sampah,NEGATIVE,"[{'label': 'NEGATIVE', 'score': 0.9856446981430054}]",0.9856446981430054
Ferensya Feren,Masih ada pungli di beberapa lokasi. Pas masuk ditarik 10rb/motor. Mau masuk ke danau ditarik lagi 5rb/org,NEGATIVE,"[{'label': 'NEGATIVE', 'score': 0.9933596253395081}]",0.9933596253395081
Uswatun Hasanah,"Kunjungan tanggal 21 November 2021. Info tiket untuk pengendara sepeda motor dikenakan tarif Rp10.000,- per sepeda motor. Tiket masuk beda lagi, tiket masuk Rp5.000,- per orang. Saya sempat tanya ke pihak yang meminta tiket masuk, katanya …",NEGATIVE,"[{'label': 'NEGATIVE', 'score': 0.9913693070411682}]",0.9913693070411682
Juniar Fadhilah,"Bagus buat foto² rekomendasi kesini pagi atau sore sekalian, tutup jam 17.30",NEGATIVE,"[{'label': 'NEGATIVE', 'score': 0.8324780464172363}]",0.8324780464172363
Firman S Hermawan,"Bukit Jaddih sejatinya adalah tambang kapur. Uniknya, saat ini pertambangan masih berlangsung, sehingga ada alat berat dan truk yang berlalu-lalang mengangkut batu kapur. …",NEGATIVE,"[{'label': 'NEGATIVE', 'score': 0.8485101461410522}]",0.8485101461410522
cahyana 104,Masih perlu perhatian dr pemerintah setempat.akses jln menuju lokasi msh bergelombang.meskipun panas tp asyik buat berfoto2 ria.,NEGATIVE,"[{'label': 'NEGATIVE', 'score': 0.8932269811630249}]",0.8932269811630249
Rodi Ae,"Akses ke wisata ini masih jelek, ada tarik'an d awal yang ngeprank wisatawan, selain itu harga msuk msih ok si..",NEGATIVE,"[{'label': 'NEGATIVE', 'score': 0.9735311269760132}]",0.9735311269760132
Annisa Priyandita,"Untuk pemandangan bukit kapur dan kita bisa masuk ke dalam goa termasuk experince lain yg patut dicoba, tp syg akses kesini jalannya lumayan jelek",NEGATIVE,"[{'label': 'NEGATIVE', 'score': 0.9984437823295593}]",0.9984437823295593
Ubinkayu,Sepi dan kurang perawatan setelah covid.  Wisata murah fan menarik,NEGATIVE,"[{'label': 'NEGATIVE', 'score': 0.9955554604530334}]",0.9955554604530334
Grace_Octavia,Tempat untuk refresing dan cocok untuk berlibur dengan keluarga. Tempat di madura dan bisa diakses dengan mobil dan motor. Membayar 10b Banyak spot foto dan banyak turis lokal juga kesini,POSITIVE,"[{'label': 'POSITIVE', 'score': 0.9983410835266113}]",0.9983410835266113
Anik Lutfiyah,"Masuk gang pertama kali bayar seikhlasnya gitu ke warga. Lalu mau masuk areanya bayar lagi 20rb untuk mobil. Pas sudah di areanya yang luas, itu nanti kita bisa milih di area tertentu yang (sepertinya) dimiliki oleh beda-beda orang. Kalau …",POSITIVE,"[{'label': 'POSITIVE', 'score': 0.8698452115058899}]",0.8698452115058899
Mister Baru,"Sempat ke goa pote aja
Bukit jaddihnya jarang yang kesana sekarang. Padahal dulu bagus",POSITIVE,"[{'label': 'POSITIVE', 'score': 0.5226084589958191}]",0.5226084589958191
Arif Rahmat Santoso,Cukup luas dan ada pemandu nya klo masuk.,POSITIVE,"[{'label': 'POSITIVE', 'score': 0.9989363551139832}]",0.9989363551139832
Fasha,"kesini H+2 hari raya Idul fitri 2023 jalan agak rusak tapi senang aja suasananya unik dan ramai suara petasan, knalpot anak2 motor khas jaddih bangkalan madura.",POSITIVE,"[{'label': 'POSITIVE', 'score': 0.9911305904388428}]",0.9911305904388428
Dwiky Patria,"Baru aja nyobain lagi datang kesini setelah beberapa tahun engga ke bukit jaddih.. entah karena lagi pandemi, yang datang kesini jauh lebih sedikit daripada dulu.. malah tadi saja sendiri saja yang datang.. di pintu masuk, ada retribusi …",NEGATIVE,"[{'label': 'NEGATIVE', 'score': 0.9960833787918091}]",0.9960833787918091
dwi hendriono,"Perjalanan sangat menyenangkan. Kanan kiri persawahan yg sejuk. Jalan lumayan halus, dan agak sepi walau agak sempit. Setiba di bukit kapur, cuacanya sangat panas. Maklum pulau Madura terkenal akan panasnya. Namun terobati dengan …",POSITIVE,"[{'label': 'POSITIVE', 'score': 0.9929298758506775}]",0.9929298758506775
Aulia Jihan RH,"Ke bukit Jaddih hari rabu (hari kerja). naik mobil empat orang dari Surabaya ke Bangkalan, waktu tempuhnya cuma setengah jam-an lewat Suramadu. Harusnya gak lama. Tapi karena ikutin rute yang disarankan sama Google maps (rute terdekat), …",NEGATIVE,"[{'label': 'NEGATIVE', 'score': 0.926713228225708}]",0.926713228225708
Vina Navika Yudha,Pas ga keliatan putih karena musim hujan.Jalan masuknya ancur.bayar 3x 😥 …,NEGATIVE,"[{'label': 'NEGATIVE', 'score': 0.9929754734039307}]",0.9929754734039307
Sistiyono MPH,Tempat bagus sayang belum didukung fasilitas jalan yg memadai dan pengelolaan yg baik.,POSITIVE,"[{'label': 'POSITIVE', 'score': 0.516480028629303}]",0.516480028629303
Gysaila Shaqila,"Parkiran cukup luas, mushola & kamar mandi cukup jauh hanya terletak di jalan masuk sebelum lokasi. Ada perahu getek juga. Terdapat banyak warung kopi. Hanya saja banyak pungli. Kurang lebih 3X harus bayar 'tiket' yang tidak jelas",NEGATIVE,"[{'label': 'NEGATIVE', 'score': 0.9974835515022278}]",0.9974835515022278
Nyta Narda Wijaya,"Tempat yang Lumayan Bagus , Sepi banget waktu kesini , cocok buat liburan rame rame bareng ,panas banget tapi kebantu angin yang lumayan kencang , 2x tarif di pintu awal dan pintu akhir , tempat bersih , full kapur dari ujung ke ujung , …",POSITIVE,"[{'label': 'POSITIVE', 'score': 0.9964087605476379}]",0.9964087605476379
Ersa,Tempatnya panas. Tapi bagus untuk foto²,POSITIVE,"[{'label': 'POSITIVE', 'score': 0.998877227306366}]",0.998877227306366
Yeni Rahmawati,Akses jalan sangat tidak bagus. Baru sampe udah diikutin orang. Mungkin warga lokal. Tapi bikin risih aja karna ngikutin terus dan terkesan maksa. Kalau emang niatnya dijadikan destinasi wisata harusnya dapat perhatian dari pemerintah setempat.,NEGATIVE,"[{'label': 'NEGATIVE', 'score': 0.9992249011993408}]",0.9992249011993408
Muin Official,"Alam yang terbentuk dari tetes keringat penduduk. Keindahannya terlihat namun belum nampak kepedulian dari penguasa desa.
Perlu komitmen bersama untuk menjadikan desa wisata yang ramah pada pengunjung.
Jika itu terjadi, insyaaAllah makmur penduduk sekitarnya",NEGATIVE,"[{'label': 'NEGATIVE', 'score': 0.9607158899307251}]",0.9607158899307251
zainur hadi,Kalau itu punya pemkab yaa kan bisa anggaran jalan masuk apbd karena bisa jadi destinasi kebanggaan bangkalan dan masyarakat setempat harus menjaga oknum pungli pungli yg tak bertanggung jawab serta keamanan tersebut agar bisa ramai destinasi tersebut dan pengunjung bisa nyaman,POSITIVE,"[{'label': 'POSITIVE', 'score': 0.9460235834121704}]",0.9460235834121704
Errin S,"Jalanan k tempat agak susah. Lagi beruntung karena hari biasa dan siang hari, jadi tidak ada pengunjung lain. Serasa VIP 😎 Mas nya baik banget nunjukin tempat2 foto, semi tur guide, sekaligus jd fotografer  🤭 …",POSITIVE,"[{'label': 'POSITIVE', 'score': 0.9341071248054504}]",0.9341071248054504
David Yohanes,"Tempat wisata bukit jaddhih ini menjadi primadona di madura, tak kalah bagusnya dengan pantai yang ada di madura...tempat ini merupakan tempat wisata dengan bukit kapur, sehingga akan sangat kotor jika kita kesini..tapi itu semua terbayar …",POSITIVE,"[{'label': 'POSITIVE', 'score': 0.8781919479370117}]",0.8781919479370117
Lila R. Sukendy,"Cuacanya panas, saya sarankan untuk kesini pagi-pagi agar tidak terlalu panas. Hati-hati dengan pungli. Sepanjang perjalanan ada beberapa point dimana kita akan diminta pungli atas nama kas desa, sumbangan desa dan sebagainya. Waktu itu …",NEGATIVE,"[{'label': 'NEGATIVE', 'score': 0.9834222793579102}]",0.9834222793579102
Hilwani Sari,"Actually B aja :')
Tapi kalo serius dirawat pasti keren banget sih
Misalnya tiap kali lumut keluar, dibersihin biar kembali putih bersih
Trus airnya juga, dijaga dari sampah biar lebih jernih",POSITIVE,"[{'label': 'POSITIVE', 'score': 0.9966055154800415}]",0.9966055154800415
Channel Inspirasi Bersama,"kesana lewat jalur suramadu
cukup mudah diakses dengan google map
karena di sepanjang jalan masih jarang ada petunjuk jalan ke tempat ini …",POSITIVE,"[{'label': 'POSITIVE', 'score': 0.886519193649292}]",0.886519193649292
Irmawan Werdyanto,"Sebenarnya Bukit Jaddih memiliki kemiripan dengan Garuda Wisnu Kencana (GWK), meski tidak apple to apple. Perlu sentuhan lagi agar eye catching dan lebih instagramable serta wisatawan ingin kembali berkunjung. Banyak yang perlu dibenahi. …",NEGATIVE,"[{'label': 'NEGATIVE', 'score': 0.9872567653656006}]",0.9872567653656006
N.H Kim,"Pungliiiiiii......
Lumayan sii banyak pungli...
Tempatnya ya udah bareng tuh sama truk2 ambil batu2, jalannya rusak, banyak …",NEGATIVE,"[{'label': 'NEGATIVE', 'score': 0.9991675615310669}]",0.9991675615310669
Shirley Megawati,Spot foto keren... Untung pas datang suasana ngk panas... Jd bisa dpt hasil foto yg bagus... Cm akses masuk ke jaddih jalannya ngk rata,POSITIVE,"[{'label': 'POSITIVE', 'score': 0.9943388104438782}]",0.9943388104438782
Lia Kusuma Indhiarti,"ما شاء الله.
Keren banget tempatnya..instagramable..
Tapi ada yg perlu diperbaiki..yaitu akses jalan menuju lokasi (ada bbrp titik …",POSITIVE,"[{'label': 'POSITIVE', 'score': 0.9659956693649292}]",0.9659956693649292
Robie Jaya,Objek wisata yg sangat sangat tidak terawat sekarang sdh tak sebagus dlu dn juga sepi pengunjung meskipun itu weekend pungli juga banyak disana tolong di berantas oknum² nakal yg mencari keuntungan disana..,NEGATIVE,"[{'label': 'NEGATIVE', 'score': 0.9996237754821777}]",0.9996237754821777
Tanto Doank,"Merupakan daerah tambang batu kapur yang juga dimanfaatkan sebagai obyek wisata.
Pengelolaan oleh pemerintah masih sangat minim, akses jalannya sulit dan banyak …",NEGATIVE,"[{'label': 'NEGATIVE', 'score': 0.9971265196800232}]",0.9971265196800232
Ganong Channel,"Jika tidak di kelola dg baik, saya khawatir tempat ini makin lama akan punah. Krn banyaknya penambang batu yg membuat cepat habis bebatuan di tempat wisata ini.",NEGATIVE,"[{'label': 'NEGATIVE', 'score': 0.9997202754020691}]",0.9997202754020691
Adhy Prasetiya,"Bukit Jaddih merupakan lokasi penambangan kapur yang hingga saat ini masih aktif. Melihat polanya, kemungkinan tambang ini dahulu dikerjakan secara manual sebelum akhirnya menggunakan alat berat seperti saat ini. Pada lokasi yang sudah …",NEGATIVE,"[{'label': 'NEGATIVE', 'score': 0.9701827764511108}]",0.9701827764511108
Ridwan Oncy,"Banyak pungli, kebanyakan  bayar pas masuk wisatanya jadi males kapok gak mau balik lagi mending ke pantai aja",NEGATIVE,"[{'label': 'NEGATIVE', 'score': 0.9976043105125427}]",0.9976043105125427
Intan Diah Pratiwi,"Bukit kapur yang menjadi wisata dan bisa menjadikan Bangkalan semakin terkenal!

Seperti selayaknya suasana bukit Kapur pada umumnya yang berdebu, terik panas …",NEGATIVE,"[{'label': 'NEGATIVE', 'score': 0.9284566640853882}]",0.9284566640853882
Wahyu Cungkring Channel,"Bukit Jaddih adalah tempat yang cocok buat yang pingin ngetrip tipis, di Bukit Jaddih anda akan disuguhi pemandangan bukit kapur dan panorama alam yang sangat bagus buat para foto grafer dan mungkin yang ingin prewed. …",POSITIVE,"[{'label': 'POSITIVE', 'score': 0.9995367527008057}]",0.9995367527008057
N3Y,Awalnya saya penasaran sampai akhirnya datanglah ke Bukit kapur yang letaknya ada di pusat kota Bangkalan ini. Ingin melihat langaung dan membuktikan sendiri keindahan bukit kapur yang diberi nama bukit Jaddih ini. Ga hanya lewat foto-foto …,POSITIVE,"[{'label': 'POSITIVE', 'score': 0.9987450838088989}]",0.9987450838088989
Risdiana Dwiwindarti,"Dulu ramai,kini sepi krn pendemi,buat pengelola ditambahkan jaring di atas supaya tidak terlalu panas,saya tgl 13 maret 2021,kasihan warung2nya.kurang promosi di medsos pengelolanya",NEGATIVE,"[{'label': 'NEGATIVE', 'score': 0.9969990253448486}]",0.9969990253448486
Ilham Rizqi07,"Ini adalah salah satu wisata terutama untuk yg suka foto2, di area madura. Tp tempat ini jd tidak terlalu jauh dari surabaya, so bagi kalian arek suroboyo, mampir rene cuk. …",POSITIVE,"[{'label': 'POSITIVE', 'score': 0.9838374257087708}]",0.9838374257087708
Ulil Ma,Salah satu wisata yg recomend di Bangkalan Madura,POSITIVE,"[{'label': 'POSITIVE', 'score': 0.9995912909507751}]",0.9995912909507751
Rudianto,"Menurut saya, Bukit Jaddih adalah tempat wisata yang benar-benar luar biasa spektakuler dan kedepan sepertinya akan terus bertambah spektakuler. …",POSITIVE,"[{'label': 'POSITIVE', 'score': 0.9994420409202576}]",0.9994420409202576
Amelia Okta,"Situs penambangan kapur yang sangat luas, dan tampaklah bukit kapur yang indah. Kalau ke madura coba mampir, sekalian ke bebek sinjay. Areanya sangat luas, pas cuaca cerah hasil foto juga sangat instagramable bgt. Masuk cm bayar parkir. Di dalamnya ada kolam renang dan danau tapi dikenakan tiket tambahan.",POSITIVE,"[{'label': 'POSITIVE', 'score': 0.9939512014389038}]",0.9939512014389038
Wahyu Widiyantoro,"Tempat yg megah dan mengagumkan. Kalau siang akan silau sekali dan berangin. Disarankan pakai kacamata. Terdapat warung minum dan toilet. Tempat parkir tersedia. Loket masuk area Goa Pote per orang Rp 5.000,- (retribusi mobil dan parkir tdk …",POSITIVE,"[{'label': 'POSITIVE', 'score': 0.9990193843841553}]",0.9990193843841553
tokocoklat mgc,"Saya ke sini juni 2019

Bukit jaddih ini adalah penambangan kapur yang dijadikan lokasi wisata.. …",NEGATIVE,"[{'label': 'NEGATIVE', 'score': 0.9869958758354187}]",0.9869958758354187
Jouddy Diana,"Hhhhmmmm... Banyak pungli, kurang nyaman karena banyak pungli. Panas dan berdebu ternyata, saya sarankan membawa kacamata biar gak kelilipan Dan sunblock biar kulit gak gosong. sepertinya cukup sekali saja berkunjung bukit Jadih, semoga kedepannya dikelola menjadi lebih baik untuk destinasi wisata yang nyaman",NEGATIVE,"[{'label': 'NEGATIVE', 'score': 0.9962032437324524}]",0.9962032437324524
Adi Suryawan,"Baru pertama kali tempatnya cukup jauh dari Kota Surabaya, berhati-hati dengan map google titik lokasinya salah, makanya kemarin tanya ke orang desa atau kampung bicaranya tidak begitu jelas, tempatnya tidak memiliki tanda papan nama …",NEGATIVE,"[{'label': 'NEGATIVE', 'score': 0.9991872906684875}]",0.9991872906684875
Bayu Prasongko,"wisata yg masih tergolong mahal, dengan pemandangan & suasana seperti itu : panas, gersang,  fasilitas minim, kotor & banyak pungli.  untuk menuju lokasi ini saja harus berhati2 dgn jalan sempit & berlubang, polisi tidur dimana2, pengendara …",NEGATIVE,"[{'label': 'NEGATIVE', 'score': 0.9833071231842041}]",0.9833071231842041
YuNi,"Kalau masuk kesini bayarnya 3 portal, 1 portal kampung, 2 portal masuk wisata, 3 portal masuk telaga. Utk tempat lumayan instragameble, disana juga ada org juala mknan dan minuman ringan, meskipun gk banyak yg jualan tp ada.",POSITIVE,"[{'label': 'POSITIVE', 'score': 0.9893590211868286}]",0.9893590211868286
Vrila,"Sebenarnya ini penambangan batu yg masih aktif, Tp lumayan bagus..ada danau kecil yg dilengkapi dg persewaan gethek bambu..sayang unt biaya tiket nya termasuk mahal. Unt mobil kena 20rb.belum ketika kita masuk ke bukit ada lagi..trus …",NEGATIVE,"[{'label': 'NEGATIVE', 'score': 0.5912386178970337}]",0.5912386178970337
RnT,"Ada 3 spot wisata yang bisa kita kunjungi. Ada kolam renang, Danau Biru, atau naik ke Bukit. Kalau mau ke Bukit Harus lebih hati-hati karena melewati jalan kendaraan penambangan batu kapur. Jalannya menanjak dan tidak rata. Sampai di atas …",NEGATIVE,"[{'label': 'NEGATIVE', 'score': 0.9972577691078186}]",0.9972577691078186
Astuti Tri,Tempatnya enak rasanya pingin sana lg,POSITIVE,"[{'label': 'POSITIVE', 'score': 0.9998407363891602}]",0.9998407363891602
iben darmawan,"Menuju Bukit Jeddih dari pintu keluar Jembatan Suramadu lurus saja, di pertigaan besar pertama belok kiri, ikuti jalan kecil aspal, hati hati bila terjadi simpangan dengan mobil, harus mengalah. Pintu masuknya tersamar, tidak ada petunjuk …",NEGATIVE,"[{'label': 'NEGATIVE', 'score': 0.9986823201179504}]",0.9986823201179504
Yohannes Evan,"Tempat wisata yg eksotis pemandangan Bagus, cocok buat foto foto. Saran kalo kesini pagi atau agak sore, udaranya seger",POSITIVE,"[{'label': 'POSITIVE', 'score': 0.9998261332511902}]",0.9998261332511902
Ririen Wisma,"Sebuah bukit kapur yang kapurnya bisa dibuat untuk bangunan rumah.  Karena perpaduan kapur dengan genangan air sehingga membuat air di sekitarnya berwarna hijau. Ada sebuah gua namanya Goa Pote. Bagus viewnya. Tetapi untuk parkirnya mahal, 50 rb untuk bus kapasitas 30 orang.",POSITIVE,"[{'label': 'POSITIVE', 'score': 0.8746868371963501}]",0.8746868371963501
Kartika Dyah,Memang untuk hunting foto. Bagus spot nya,POSITIVE,"[{'label': 'POSITIVE', 'score': 0.9995007514953613}]",0.9995007514953613
Diva Sasmita Widitama,"Tempatnya kalo hari biasa sepi , tp kalo idealnya diatas jam 12 soalnya matahari sudah di barat jadi tidak terlalu panas
Tiket masuk mobil 20rb dan motor 10rb
Untuk ke goa pote ditambah lagi per orang 5rb",POSITIVE,"[{'label': 'POSITIVE', 'score': 0.9700184464454651}]",0.9700184464454651
Hany Hany,Wisata bukit Jaddih lumayan juga buat rekreasi keluarga. Masuk pertama bayar 5rb trus parkir masuk pertama bayar 25rb trus parkir kedua bayar 20rb. Ini yg parkir ke goa pote. Setelah dapet parkiran baru jalan menuju wisata. Pilihan bisa …,POSITIVE,"[{'label': 'POSITIVE', 'score': 0.9813448190689087}]",0.9813448190689087
Azaukamaiqi Right,"hati2 pungli di area wisata.. biaya masuk hanya 1x, berbeda dgn biaya utk berenang. siap sedia kacamata dan masker krna debu kapur banyak berterbangan, terutama saat panas",NEGATIVE,"[{'label': 'NEGATIVE', 'score': 0.9972206354141235}]",0.9972206354141235
Lesia Issaura Eunike,Tempaynya sangat panas.. Ini adalah semacam tebing kapur yang masih d kelolah secara tradisional oleh penduduk sekitar.. Saat maret 2018 saya ke sana pekerja juga sedang membuat kamar2 yg nantinya akan d sewakan untuk pengunjung. Kamar …,POSITIVE,"[{'label': 'POSITIVE', 'score': 0.9587230682373047}]",0.9587230682373047
