nama,ulasan,label,sentiment,score
JUANDFI CHANNEL,Sangat bagus dan keren buat foto..,POSITIVE,"[{'label': 'POSITIVE', 'score': 0.9998677968978882}]",0.9998677968978882
Hidayat Hadi,"Bagusss sekali cumaa PUNGLINYA ITULOHH....  WAGELASEEEHH!!  bikin gak lagi lagi kesana sebelum bener bener di atur tur tur..  Jalan berapa meter bayar ...jalan lagi bayar...  Jalan lagi bayar...  -.-"") keterlaluan sih menurutku.",NEGATIVE,"[{'label': 'NEGATIVE', 'score': 0.9992747902870178}]",0.9992747902870178
Teguh Sinulingga,Tempat penggalian kapur yang dijadikan tempat wisata,NEGATIVE,"[{'label': 'NEGATIVE', 'score': 0.9905762672424316}]",0.9905762672424316
Angga Cita,"Tempatnya memang indah pemandangan nya, tetapi untuk tiket masuk setiap kawasan haruskah bayar lagi ?",POSITIVE,"[{'label': 'POSITIVE', 'score': 0.8621302247047424}]",0.8621302247047424
budiharjo gitowiryono,"pada dasarnya bagus, namun masih perlu banyak perbaikan dan pengembangan",NEGATIVE,"[{'label': 'NEGATIVE', 'score': 0.9919488430023193}]",0.9919488430023193
anthony enrico,"Pemandanganya bagus, klo kesini mendingan di sore hari. Supaya tidak kena terik matahari yg panas",POSITIVE,"[{'label': 'POSITIVE', 'score': 0.99577796459198}]",0.99577796459198
arum “Sari” puspa sari,Bagus tapi menyeramkan 😂. Kalo berangkat sama2 cewe. Jalanan curam. Mending naik mobil pas kesini soalnya debunya bertebaran. Trus danaunya kalo pas musim panas ijo enggak biru lagi. …,NEGATIVE,"[{'label': 'NEGATIVE', 'score': 0.9937356114387512}]",0.9937356114387512
Agus Yuliyanto,"View nya bagus
Tempatnya dingin dan sejuk",POSITIVE,"[{'label': 'POSITIVE', 'score': 0.9998350143432617}]",0.9998350143432617
Leni Edi,Tempatnya artistik ..bagus u foto spot.. cuman agak panas..,POSITIVE,"[{'label': 'POSITIVE', 'score': 0.9984915256500244}]",0.9984915256500244
Kimi Hikari,"Disini pemandangan dari atas sangatlah indah, dengan dikelilingi pegunungan kapur. Menjadi tempat yang sangat menarik",POSITIVE,"[{'label': 'POSITIVE', 'score': 0.9995123147964478}]",0.9995123147964478
Galih Amrullah,Monggo honda brio tahun 2016 manual wa 082330427059,NEGATIVE,"[{'label': 'NEGATIVE', 'score': 0.9678652286529541}]",0.9678652286529541
dianawek dian,"Keren bnget.. Unik dengan ukiran batu kapur yg dibentuk sedemikian rupa

Cukup dengan 35rb saja..  Video lebih lanjut bisa tonton dichannel
youtube dianawek dian",POSITIVE,"[{'label': 'POSITIVE', 'score': 0.9962356686592102}]",0.9962356686592102
fardha fadillah,"Bagus sih tmpt nya😊, tp nggak ada tmpt buat berteduh
Panas bgt🥵🥵 …",NEGATIVE,"[{'label': 'NEGATIVE', 'score': 0.9814565181732178}]",0.9814565181732178
Muhammad Farid,"Keren, sebuah tempat bekas pertambangan yg dijadikan tempat wisata",POSITIVE,"[{'label': 'POSITIVE', 'score': 0.9723968505859375}]",0.9723968505859375
binda banatau,"Pilihan wisata yang bagus, hanya saja terlalu banyak preman. Dikit2 bayar.",NEGATIVE,"[{'label': 'NEGATIVE', 'score': 0.9321970343589783}]",0.9321970343589783
Sahat Tampubolon,Wisata alam yg patut anda kunjungi... viewnya keren dan htm murah meriah...,NEGATIVE,"[{'label': 'NEGATIVE', 'score': 0.998978853225708}]",0.998978853225708
Tya Tiyul,"Akses masih buruk, akan lebih baik juga jika diberikan penunjuk arah masuk dan keuar. Karena sangat membingungkan",NEGATIVE,"[{'label': 'NEGATIVE', 'score': 0.9998062252998352}]",0.9998062252998352
Lucky Indriana,Tidak direkomendasikan untuk mengendarai sepeda motor karena medan berupa batuan kapur berlumut yang bisa menyebabkan sepeda motor tergelincir. Sedia sunscreen dan masker karena suhu udara sangat panas dan berdebu akibat proses penambangan batuan kapur.,NEGATIVE,"[{'label': 'NEGATIVE', 'score': 0.9990736246109009}]",0.9990736246109009
Thobias Andhika,"Tempatnya menarik kalau di explore lagi, banyak hidden spot yang sepi banget jauh dari wisatawan pada umunya.",POSITIVE,"[{'label': 'POSITIVE', 'score': 0.9905147552490234}]",0.9905147552490234
Arif Prasojo,"Istagramable banget, bagus cuma kalo siang hari panas",POSITIVE,"[{'label': 'POSITIVE', 'score': 0.9918901920318604}]",0.9918901920318604
Bebe Donk,"Wisata eks penambangan batu (kapur)

Waktu akan masuk ke lokasi wisata, pengunjung dikenakan bea masuk : …",NEGATIVE,"[{'label': 'NEGATIVE', 'score': 0.7390178442001343}]",0.7390178442001343
Anna Dh,Sukaaa banget  panoramanya dan terima kasih banyak buat bpak yg fotoin kita,POSITIVE,"[{'label': 'POSITIVE', 'score': 0.9998564720153809}]",0.9998564720153809
Sugeng Lisa,Bagus sih tapi yg gak kuat debunya itu lhoo,NEGATIVE,"[{'label': 'NEGATIVE', 'score': 0.9963399171829224}]",0.9963399171829224
Mas Purwo (Mas Purwo),Buat spot photo aja sih klo LG kemarau,NEGATIVE,"[{'label': 'NEGATIVE', 'score': 0.9966205358505249}]",0.9966205358505249
AR1 CHANEL,"Tempat nya bagus,  sangat di sayangkan Pungli Pungli juga,  jalan masuk lokasi juga sangat bagus  dan Sangat di harapkan dinas parawisata yamg berkaitan Tolong di benahi.",POSITIVE,"[{'label': 'POSITIVE', 'score': 0.999210000038147}]",0.999210000038147
Tio Arifiadi,Bayar 10 rb tiap mau masuk lebih jauh,NEGATIVE,"[{'label': 'NEGATIVE', 'score': 0.9817392826080322}]",0.9817392826080322
Deny Setyawan,Masih ada proses tambang dan kurang diurus. Sayang potensi wisata ini,NEGATIVE,"[{'label': 'NEGATIVE', 'score': 0.9991829991340637}]",0.9991829991340637
Hari Hartono,Bagus sekali. Sangat potential untuk dikembangkan. Akses jalan dan pengelolaan obyek wisata perlu ditingkatkan,POSITIVE,"[{'label': 'POSITIVE', 'score': 0.5878792405128479}]",0.5878792405128479
Niko San,Danau yang di bawah kurang bagus. Lebih bagus naik le atas bukitnya. Viewnya mantap.,POSITIVE,"[{'label': 'POSITIVE', 'score': 0.9840376377105713}]",0.9840376377105713
Ulin Chanel,"Masih alami dan tradisional, penambangan kapurnya masih aktif sehingga agak mengganggu pariwisata, pengelolaan masih kurang profesional",NEGATIVE,"[{'label': 'NEGATIVE', 'score': 0.9988516569137573}]",0.9988516569137573
Innararetya Khadijah6A,Bulan Agustus kesana..  Danaunya surut.. pdhal klo pas airnya penuh lebih bagus,NEGATIVE,"[{'label': 'NEGATIVE', 'score': 0.5151040554046631}]",0.5151040554046631
Andika Ndra,"Wisata bukit tambang batu kapur, parkir mobil 10 rb",POSITIVE,"[{'label': 'POSITIVE', 'score': 0.9775960445404053}]",0.9775960445404053
oyik oyik,Tempat nan indah dan sempurna untuk berpose serasa berada di dunia dongeng,POSITIVE,"[{'label': 'POSITIVE', 'score': 0.9998840093612671}]",0.9998840093612671
HONDA ASTREA SERIES Surabaya - Sidoarjo,"Akibat keserakahan manusia bukit jaddih lama"" akan hilang",NEGATIVE,"[{'label': 'NEGATIVE', 'score': 0.9995935559272766}]",0.9995935559272766
Suprapto Prapto,"Pemandangan landscap bagus, bisa dikembangkan menjadi kawasan pariwisata yg potensial di Madura. Sayang akses jalan masuk belum memadai",NEGATIVE,"[{'label': 'NEGATIVE', 'score': 0.9946756362915039}]",0.9946756362915039
Demes Mustika,Panas. Dan mahal tiket nya. Masa disuruh bayar 2 kali. 2 org 40rb . Tempat nya mengecewakan. Parahh,NEGATIVE,"[{'label': 'NEGATIVE', 'score': 0.9996046423912048}]",0.9996046423912048
A Jun41,"Tidak ada petunjuk arah ke objek wisata
Bagi orang yg pertama kali ke situ pasti bingung, hanya mengandalkan GPS saja",NEGATIVE,"[{'label': 'NEGATIVE', 'score': 0.9971063733100891}]",0.9971063733100891
alifah febrian,"Walaupun panas dan debu, tapi ntah lah suka aja sama tempat ini.. kece bgttt 😍😍😍😍 …",POSITIVE,"[{'label': 'POSITIVE', 'score': 0.9995065927505493}]",0.9995065927505493
RINA AZCHAR,"Tempat wisatanya lumayan bagus, tp panas",POSITIVE,"[{'label': 'POSITIVE', 'score': 0.9995591044425964}]",0.9995591044425964
Etha Dewi,"Baguss sih , cuma hati hati aja , bnyak tarikan liar",POSITIVE,"[{'label': 'POSITIVE', 'score': 0.9985492825508118}]",0.9985492825508118
Salama Amah,Minusnya cuma kurang terawat aja,NEGATIVE,"[{'label': 'NEGATIVE', 'score': 0.9997902512550354}]",0.9997902512550354
Rio Zulfikar,"Bukitnya tidak buruk, lumayan buat foto2, hawanya panas",POSITIVE,"[{'label': 'POSITIVE', 'score': 0.9982339143753052}]",0.9982339143753052
Yeni Sisnawati,Jng bagus viewnya utk swa berfoto,POSITIVE,"[{'label': 'POSITIVE', 'score': 0.9995505213737488}]",0.9995505213737488
OM HENDS,lokasi penambangan batu gamping yang sebagian lahannya dugunakan untuk obyek wisata,NEGATIVE,"[{'label': 'NEGATIVE', 'score': 0.9721056818962097}]",0.9721056818962097
Annisa Fira,"Tempatnya bagus buat foto. Biayanya murah meriah,cuma 10 ribu per 2 orang plus motor.",NEGATIVE,"[{'label': 'NEGATIVE', 'score': 0.9943880438804626}]",0.9943880438804626
Maulida al fita,Tempat nya bagus untuk tiket masuk 30. Kalau mau naik keatas harus nambah biaya padahal tmpt sama saja,POSITIVE,"[{'label': 'POSITIVE', 'score': 0.79036945104599}]",0.79036945104599
elizabeth wulandari,"Bagus tapi panas bgt, banyak restribusi yg gak jelas, penunjuk arah tidak jelas",NEGATIVE,"[{'label': 'NEGATIVE', 'score': 0.9983813762664795}]",0.9983813762664795
Rian Prio Bramantio,Perlu ditingkatkan dan dikembangkan lagi agar lebih atraktif dan menarik.,POSITIVE,"[{'label': 'POSITIVE', 'score': 0.8316946029663086}]",0.8316946029663086
okta viana nurrohmah,Tambang batu putih di Madura menjadi daya tarik wisata,POSITIVE,"[{'label': 'POSITIVE', 'score': 0.9984886646270752}]",0.9984886646270752
Mohammad Aditya Putra,Bagusss,NEGATIVE,"[{'label': 'NEGATIVE', 'score': 0.9844978451728821}]",0.9844978451728821
eko genrush,"Jalannya Jelek banget, sementara bayarnya Masuk Mobil bayar mahal mobil 20rb, Elf/30rb, Bis tanggung/50rb, Bus besar/80rb, kalau di lokasi 5000/pengunjung",NEGATIVE,"[{'label': 'NEGATIVE', 'score': 0.9994626641273499}]",0.9994626641273499
Egha Fitri,Bagus...tapi panasnya mintak ampunnnn😅gpp yg penting seru👍 …,POSITIVE,"[{'label': 'POSITIVE', 'score': 0.9983043670654297}]",0.9983043670654297
Agus Budianto,Semakin keren saja bukit kapur yang ada di ujun barat pulau madura ini 👍👍 …,NEGATIVE,"[{'label': 'NEGATIVE', 'score': 0.9709538221359253}]",0.9709538221359253
Yuliana Ana,Tempatnya panas siap2 bawa payung. Terlalu banyak retribusi menjengkelkan.,NEGATIVE,"[{'label': 'NEGATIVE', 'score': 0.9844802021980286}]",0.9844802021980286
Sarung Bugis,Lumayan mempesona cuma kli siang kurng bagus. Saran buat yang mau kesini pagi banget atau sore sklian,POSITIVE,"[{'label': 'POSITIVE', 'score': 0.9997255206108093}]",0.9997255206108093
Rio Al-Hilmiy,Sudah mulai di perbaiki menjadi tempat Wisata,NEGATIVE,"[{'label': 'NEGATIVE', 'score': 0.5062928199768066}]",0.5062928199768066
sulis susantok,"Kurangnya penunjuk jalan, lokasi yg berdebu namun di goa pote lumayan dingin dan sejuk,  lokasi berdebu karena area tambang batu kapur",NEGATIVE,"[{'label': 'NEGATIVE', 'score': 0.9946771860122681}]",0.9946771860122681
Fiko Agung,"Pertambangan kapur yang di jadikan objek wisata,  ada goa2 buatan,  danau dan tebing2 kapur.",NEGATIVE,"[{'label': 'NEGATIVE', 'score': 0.873077929019928}]",0.873077929019928
rhie yan,"Jika berkunjung di sarankan memakai masker,  karna debu yg sangat bnyak",NEGATIVE,"[{'label': 'NEGATIVE', 'score': 0.9964912533760071}]",0.9964912533760071
EKO PRASTIYO,"Yang suka photograpy disarankan ke tempat ini, keren banget, minus : fasilitas masih kurang n panas banget",POSITIVE,"[{'label': 'POSITIVE', 'score': 0.9983932375907898}]",0.9983932375907898
Adi Irawan,"Panas sekali, tapi untuk view foto banyak spot yang keren",POSITIVE,"[{'label': 'POSITIVE', 'score': 0.9993250370025635}]",0.9993250370025635
enna najma,"Wisata alam dengan memanfaatkan bekas pertambangan, sangat cocok untuk selfi, lokasinya juga dekat dengan makam mbah kholil",POSITIVE,"[{'label': 'POSITIVE', 'score': 0.8115816712379456}]",0.8115816712379456
Ilham Fatahillah,Indahnya tak seperti dulu.. Kata teman yg saya ajak. Tak seperti ekspektasinya.,NEGATIVE,"[{'label': 'NEGATIVE', 'score': 0.9997461438179016}]",0.9997461438179016
novia,"Pertama masuk liat putih putih di pikiran langsung kebayang ""surga"" ada kolam renangnya juga",POSITIVE,"[{'label': 'POSITIVE', 'score': 0.9914584755897522}]",0.9914584755897522
Herman Darmansjah,Saat ini tempat wisatanya sdh ditutup karena sdh rusak berat akibat kegiatan penambangan batu putih (kapur) yang masif.. jalan aksesnya sdh rusak juga akibat repetisi beban roda² truk pengangkut batu..,NEGATIVE,"[{'label': 'NEGATIVE', 'score': 0.9995020627975464}]",0.9995020627975464
Felicia Kleantha Setiadi,harga tiket 5000 per org,NEGATIVE,"[{'label': 'NEGATIVE', 'score': 0.947604775428772}]",0.947604775428772
Adventina Permata cahya,"Banyak tukang parkir abal2 yang minta biaya parkir padahal kami sudah bayar parkir di depan, selebihnya bagus viewnya",NEGATIVE,"[{'label': 'NEGATIVE', 'score': 0.9895514845848083}]",0.9895514845848083
Hafidh,Bekas pertambangan yg disulap menjadi obyek wisata,POSITIVE,"[{'label': 'POSITIVE', 'score': 0.996944010257721}]",0.996944010257721
gita pu,"Tidak tertata, petunjuk masuk tidak ada, tiket sangat mahal, tidak ada fasilitas yang berfungsi, hanya hanya truck pasir",NEGATIVE,"[{'label': 'NEGATIVE', 'score': 0.9979923963546753}]",0.9979923963546753
Alfan Ramadhan,"Ini tempat yang indah dan ini bisa untuk di petualangan ni
Dan bisa ngajak keluarga dan teman teman",POSITIVE,"[{'label': 'POSITIVE', 'score': 0.9998505115509033}]",0.9998505115509033
Santi Nuryani,"Lokasi tambang batu kapur yg bagus untuk jadi spot foto2.
Tempat masih bersih belum terlalu rame.... Tiket masuk juga murah.",NEGATIVE,"[{'label': 'NEGATIVE', 'score': 0.9330856800079346}]",0.9330856800079346
Benediktus Kristiadi,Kerennn tempatnya cocok untuk bersantaii 👍 …,POSITIVE,"[{'label': 'POSITIVE', 'score': 0.9957388639450073}]",0.9957388639450073
A D,Panas luar biasa..😃tapi terbayar dengan  pemandangan batu kapur yang indah..Hasil foto Ok .Tidak mengecewakan . …,POSITIVE,"[{'label': 'POSITIVE', 'score': 0.9998041987419128}]",0.9998041987419128
andy iwo,cukup menarik.....jln banyak yg rusak....,NEGATIVE,"[{'label': 'NEGATIVE', 'score': 0.9989068508148193}]",0.9989068508148193
Giyanto Giyanto,Kapok saya kesana....baru belok dari jalan aspal menuju lokasi sudah ada tarikan 10 rb. Masuk lokasi ada tarikan 20 rb. Terus masuk parkir untuk foto foto ada tarikan 20 rb. Pindah ke spot yg lain ada tarikan 20 rb lagi.... Bosan disana …,NEGATIVE,"[{'label': 'NEGATIVE', 'score': 0.997268557548523}]",0.997268557548523
Fitri Handayani,Semua bagus..  Sayangnya toiletnya airnya kotor,NEGATIVE,"[{'label': 'NEGATIVE', 'score': 0.9983124732971191}]",0.9983124732971191
Bangun Pagi,sangat recomend sayang banyak pungli. harus ditindak tegass,NEGATIVE,"[{'label': 'NEGATIVE', 'score': 0.9878692030906677}]",0.9878692030906677
Dito Arianto,Lumayan buat isi waktu luang cuma jangan kesini waktu pagi atau siang,NEGATIVE,"[{'label': 'NEGATIVE', 'score': 0.9792138934135437}]",0.9792138934135437
Arifin Driver72,"Sangatlah sayang lokasi ini, sekarang sepi karena dampak Corona",NEGATIVE,"[{'label': 'NEGATIVE', 'score': 0.9991942048072815}]",0.9991942048072815
Internusa HeatingElement,"Mengecewakan sekali, banyak pungutan liar. Belok dari jalan aspal menuju lokasi dah kena 10 rb. Masuk lokasi kena 20 rb. Masu ke area kena 20 rb. Pindah mobil kena 20 rb. Pindah mobil lagi untuk foto foto kena 20 rb. Kapoooook saya kesana... Pungutan liar tok...",NEGATIVE,"[{'label': 'NEGATIVE', 'score': 0.9989786148071289}]",0.9989786148071289
Ahmad Barok,"Tempatnya bagus sekali gan sangat ramai pada hari sabtu minggu,,
Hari2 biasa jangan kesini sendirian mending pas rame rame..",POSITIVE,"[{'label': 'POSITIVE', 'score': 0.9953513145446777}]",0.9953513145446777
Hesti Dewie,"viewnya bagus ....
musti bawa kacamata hitam biar g silau krn pantulan tebing",POSITIVE,"[{'label': 'POSITIVE', 'score': 0.9912607073783875}]",0.9912607073783875
arief,Tempatnya panas kalok siang hari tapi semua itu terbayarkan dengan view yg begitu indah....,POSITIVE,"[{'label': 'POSITIVE', 'score': 0.9956992864608765}]",0.9956992864608765
Annyssa Maylia,Pas otw kesana harus hati2 soalnya banyak banget yg narikin uang gk jelas. Terus tiba2 pas udh diatas dimintain uang tiket msuk padahal td d bawah udh bayar.  Hati2 ya guys,NEGATIVE,"[{'label': 'NEGATIVE', 'score': 0.9983091354370117}]",0.9983091354370117
Stefani Gabriela,Bagus tetapi terlalu banyak pungutan liar.,NEGATIVE,"[{'label': 'NEGATIVE', 'score': 0.995433509349823}]",0.995433509349823
Eric Juanto,"Bukit Jaddih tempat tujuan bersepeda yang bagus, pemandangannya bagus dan rintangan yang menggoda,, disarankan memakai sepeda BMX atau MTB, tidak disarankan menggunakan sepeda lipat karena jalanan yang sangat tidak rata.
Bersepeda agak pagi biar tidak kepanasan",NEGATIVE,"[{'label': 'NEGATIVE', 'score': 0.7868856191635132}]",0.7868856191635132
Ersa Azizah,"Saran saya kalau kesini menjelang sore aja supaya matahari agak redup. Mengingat tanahnya adalah batu kapur, warnanya putih, jadi silau banget di mata. Sumpah. Kalian wajib pake kacamata hitam biar mantap foto2nya. …",POSITIVE,"[{'label': 'POSITIVE', 'score': 0.9890363812446594}]",0.9890363812446594
Anna Wijayanti,Spot foto bagus tp sayang banyak pungli dan preman. Orang2 nya tdk bersahabat.,NEGATIVE,"[{'label': 'NEGATIVE', 'score': 0.9947426319122314}]",0.9947426319122314
Sal Sali,Bagus buat spot foto. Tapi kalo kesana disarankan lewat Bangkalan Kota untuk yg cuma rombongan 2 orang atau 4 orang,NEGATIVE,"[{'label': 'NEGATIVE', 'score': 0.5604592561721802}]",0.5604592561721802
Farouk Yufara,klo hari libur atau tanggal merah rame bgt..akses lwt sana lebih enak arah dr terminal bangkalan,NEGATIVE,"[{'label': 'NEGATIVE', 'score': 0.9979006052017212}]",0.9979006052017212
Dyah Anr,"Tempatnya asli, asli panas😅
Untuk masuk kesana kudu bayar 3x
Pertama seikhlasnya …",POSITIVE,"[{'label': 'POSITIVE', 'score': 0.9978183507919312}]",0.9978183507919312
Dian Widyaningtyas,Nggak secantik dulu,NEGATIVE,"[{'label': 'NEGATIVE', 'score': 0.9989801049232483}]",0.9989801049232483
Vina Himma,Bagus banget tempatnyaa. Cocok buat refreshing,POSITIVE,"[{'label': 'POSITIVE', 'score': 0.9998549222946167}]",0.9998549222946167
the skinny feet,"Sekedar nostalgia Ini photo pas jaddih masih awal awal tenar , sampai skrng belum kesini lagi terakhir liat skrng udah mirip kyk di iceland",POSITIVE,"[{'label': 'POSITIVE', 'score': 0.9980944991111755}]",0.9980944991111755
Noor Juliadi,Sayang tempatnya ndak terawat dengan baik,NEGATIVE,"[{'label': 'NEGATIVE', 'score': 0.9997082352638245}]",0.9997082352638245
Aditya Nugroho,Tempatnya bagus buat foto foto dan unik,POSITIVE,"[{'label': 'POSITIVE', 'score': 0.9998646974563599}]",0.9998646974563599
073_ Nanda D Kartika,"Bagus untuk dikunjungi, untuk teman2 yang lagi main kemadura",POSITIVE,"[{'label': 'POSITIVE', 'score': 0.5518665909767151}]",0.5518665909767151
Latiful Hisyam,Tempat nya asi...pemandangan nya juga  agus cocok buat yang suka adventure,POSITIVE,"[{'label': 'POSITIVE', 'score': 0.9998713731765747}]",0.9998713731765747
Erza Minatullah,Puanase poll! Tapi keren banget lah buat pepotoan!!,POSITIVE,"[{'label': 'POSITIVE', 'score': 0.9995903372764587}]",0.9995903372764587
mohammed alfin,Infrastruktur nya masih blm tertata baik,NEGATIVE,"[{'label': 'NEGATIVE', 'score': 0.9997424483299255}]",0.9997424483299255
Dito Channel,"Tempat keren, lebih keren kalau akses jalannya lebih bagus.",NEGATIVE,"[{'label': 'NEGATIVE', 'score': 0.9752016067504883}]",0.9752016067504883
aksis mulyana,Rumayan lah bagus,POSITIVE,"[{'label': 'POSITIVE', 'score': 0.9998618364334106}]",0.9998618364334106
Mudjianto Mudjianto,Lebih diperbaiki sarananya..agar lebih banyak yang berkunjung,NEGATIVE,"[{'label': 'NEGATIVE', 'score': 0.9083384275436401}]",0.9083384275436401
Sardani Muhammad,Bukit dgn panorama yg luar biasa indah..,POSITIVE,"[{'label': 'POSITIVE', 'score': 0.9998741149902344}]",0.9998741149902344
No Name,"Puanas,persiapan bawa kacamata hitam biar ngga silau",POSITIVE,"[{'label': 'POSITIVE', 'score': 0.9087792634963989}]",0.9087792634963989
Nurman Riyadi Rahman,Tempat yang bagus dengan pemandangan batu kapur yang unik. Recommended buat pecinta fotografi,POSITIVE,"[{'label': 'POSITIVE', 'score': 0.9996403455734253}]",0.9996403455734253
Moh. Nurul Azmi,"Satu Kata Deh, Wonderfull Madura 😙😙, Sekali Lagi Bangga Di Indonesia …",POSITIVE,"[{'label': 'POSITIVE', 'score': 0.9996145963668823}]",0.9996145963668823
kentank,"Tempatnya bagus di luar ekspektasi, untuk masuknya kemaren gratis sih pas pagi, gatau tapi bayar atau ga.",POSITIVE,"[{'label': 'POSITIVE', 'score': 0.9988588094711304}]",0.9988588094711304
Bagus Kurniawan,Kurang tertata (semrawut) pengalaman masuk harus bayar 2X.. Spot foto kurang 😊 …,NEGATIVE,"[{'label': 'NEGATIVE', 'score': 0.9962595701217651}]",0.9962595701217651
Hallow,Tempat lumayan. Tapi panas dan banyak tukang palaknya,POSITIVE,"[{'label': 'POSITIVE', 'score': 0.9941086769104004}]",0.9941086769104004
Santi Octavia,Tempat yang bagus dan keren untuk foto2... intragamble...,POSITIVE,"[{'label': 'POSITIVE', 'score': 0.9998630285263062}]",0.9998630285263062
Rigukkk Saputra,"Jangan kesini pas siamg hari ya...
Alamat g bisa foto²",NEGATIVE,"[{'label': 'NEGATIVE', 'score': 0.9971703886985779}]",0.9971703886985779
Muhammad Asri,Kurang terawat. Sistem tiket masuk buruk.,POSITIVE,"[{'label': 'POSITIVE', 'score': 0.6697894334793091}]",0.6697894334793091
Rubi Strubi,tempat wisata yang unik dan  bagus,POSITIVE,"[{'label': 'POSITIVE', 'score': 0.9998805522918701}]",0.9998805522918701
erlangga kusumo Widodo,"Eksotis,buat wisata anti mainstream. Kebersihan perlu ditingkatkan. Tdk rekom buat mobil jenis sedan kesini karena medannya bergelombang",NEGATIVE,"[{'label': 'NEGATIVE', 'score': 0.9927411079406738}]",0.9927411079406738
zahsf zahsf,"Karena tempatnya panas, dianjurkan menggunakan payung dan kacamata bagi yg takut panas tidak rekomendasi ke sini deh. Daripada ribet manja.haha",NEGATIVE,"[{'label': 'NEGATIVE', 'score': 0.9831162095069885}]",0.9831162095069885
Roshad 015 Chanel,Barusan siang tadi kesana karena penasaran tapi nyampe sana malah dibikin emosi masih ada punglinya masuk bayar karcis 10rb mau nyampe dilokasi goa putih ada yang narik 10rb lagi tanpa karcis,NEGATIVE,"[{'label': 'NEGATIVE', 'score': 0.9976962208747864}]",0.9976962208747864
dayat rahmad,Sudah dua kali kesini view nya gak kalah sama yg diluar negri apa lagi saya sudah kedua kali ke bukit jeddih audah banyak yg diperbaiki ramah untuk wisata,POSITIVE,"[{'label': 'POSITIVE', 'score': 0.9737201929092407}]",0.9737201929092407
Singgih Junaedi,Bagus juga asal bisa ambil spot yg bagus untuk foto,POSITIVE,"[{'label': 'POSITIVE', 'score': 0.9998186230659485}]",0.9998186230659485
Kudi arto,Tempat instagrammable. Minusnya adalah jalur ke lokasi dan terdapat beberapa pungutan (unofficial). Potensi berkembang lebih baik lagi.,NEGATIVE,"[{'label': 'NEGATIVE', 'score': 0.9789761900901794}]",0.9789761900901794
Uus Gustiawan,Alhamdulillah pulang dari bali  bisa mampir disini.,NEGATIVE,"[{'label': 'NEGATIVE', 'score': 0.6232437491416931}]",0.6232437491416931
teambull gerry,Bagus dan indah sayang kurang dikelola dengan baik sebagai obyek wisata,NEGATIVE,"[{'label': 'NEGATIVE', 'score': 0.9991125464439392}]",0.9991125464439392
bibit rosida,Bukan kali pertama kesini... Tp rasanya masih banyak sudut yg belum terekspose....,POSITIVE,"[{'label': 'POSITIVE', 'score': 0.9369006156921387}]",0.9369006156921387
Pistachio,"Tempatnya sangat bagus, kalo pagi2 banget sekitar jam  setengah 7 kesini terus foto2 berasa kayak ada di gunung Es.
Menuju siang cuaca panas, saya sarankan pakai sunblock/sunscreen, berasa ada di …",POSITIVE,"[{'label': 'POSITIVE', 'score': 0.9983838796615601}]",0.9983838796615601
amira rahma,Bagus buat foto2x,POSITIVE,"[{'label': 'POSITIVE', 'score': 0.9992201328277588}]",0.9992201328277588
arif Irja,"Sptnya sdh tdk semenarik waktu awal2 dibuka ditambah banyaknya yg melakukan pungutan yg tdk resmi, minim sarpras penunjang, kurangnya petunjuk jalan ke tempat wisata dimaksud ditambah pandemi, menjadikannya sepi pengunjung. Kasihan orang2 …",NEGATIVE,"[{'label': 'NEGATIVE', 'score': 0.9997919201850891}]",0.9997919201850891
Dwi Rahmawan,Ada perahu buat foto ada juga kolam renang,POSITIVE,"[{'label': 'POSITIVE', 'score': 0.5133113861083984}]",0.5133113861083984
Dyan Anggraini,Bekas tambang kapur yg jd obyek wisata,POSITIVE,"[{'label': 'POSITIVE', 'score': 0.9975501894950867}]",0.9975501894950867
Heroes Agung,Tempat wisata Bangkalan yg terkenal....,POSITIVE,"[{'label': 'POSITIVE', 'score': 0.999150276184082}]",0.999150276184082
Kezia Tan,"Pemandangannya bagus kok di sana. Tempatnya instagram-able juga. Tapi sayang banyak pungli dari warga lokal. Pertama disuruh bayar kas kampung 10ribu, di dalem masih harus bayar lagi tiket masuk per orang, setelah di tempat parkir juga …",NEGATIVE,"[{'label': 'NEGATIVE', 'score': 0.9973770380020142}]",0.9973770380020142
Ardian Rahcman Prasetiyo,Wisata di madura yang foto instagramable dan mueah . Ini foto jaddih 2 tahun lalu,NEGATIVE,"[{'label': 'NEGATIVE', 'score': 0.9818337559700012}]",0.9818337559700012
Yuslimul marufa,Tempatnya bagus dan berpotensi hanya saja akses ke sana belum terlalu mudah.,NEGATIVE,"[{'label': 'NEGATIVE', 'score': 0.9832738637924194}]",0.9832738637924194
ASIH .Gresik,"Indah tapi panas, banyak bayar parkirnya",POSITIVE,"[{'label': 'POSITIVE', 'score': 0.8083340525627136}]",0.8083340525627136
Ikhman Achmad Ayyub,"Jaddih - Riwayatmu kini -
Dari sebuah Bukit kecil indah sampai Hari ini sebagai kawasan yang bahkan menurutku sudah tak layak lagi disebut sebagai sebuah Tempat Wisata. …",NEGATIVE,"[{'label': 'NEGATIVE', 'score': 0.99642014503479}]",0.99642014503479
Kacong Herus,Bagus untuk menenangkan diri dan bertapa.,POSITIVE,"[{'label': 'POSITIVE', 'score': 0.9969820380210876}]",0.9969820380210876
Ifsan Dwinanto,Mantap buat selfie n jalan2 murah meriah di pulau madura,NEGATIVE,"[{'label': 'NEGATIVE', 'score': 0.9219930171966553}]",0.9219930171966553
beeflow88,Pemandangannya bagus. Walaupun jalannya jelek.,POSITIVE,"[{'label': 'POSITIVE', 'score': 0.9993804693222046}]",0.9993804693222046
